{
  "$schema": "https://json-schema.org/draft/2020-12/schema",
  "type": "object",
  "additionalProperties": true,
  "required": ["metadata", "stats", "accounts", "sections"],
  "properties": {
    "metadata": {
      "type": "object",
      "additionalProperties": true,
      "required": ["generatedAt", "date", "timezone", "lastSuccessfulBuildAt", "dataFreshThrough"],
      "properties": {
        "generatedAt": { "type": "string" },
        "date": { "type": "string" },
        "timezone": { "type": "string" },
        "lastSuccessfulBuildAt": { "type": "string" },
        "dataFreshThrough": { "type": "string" },
        "liveUrl": { "type": "string" },
        "todayLabel": { "type": "string" },
        "tomorrowLabel": { "type": "string" }
      }
    },
    "stats": {
      "type": "object",
      "additionalProperties": true,
      "required": ["emailsScanned", "urgent", "eventsTomorrow", "proposedEvents", "suggestedReplies", "todos"],
      "properties": {
        "emailsScanned": { "type": "number" },
        "urgent": { "type": "number" },
        "eventsTomorrow": { "type": "number" },
        "proposedEvents": { "type": "number" },
        "suggestedReplies": { "type": "number" },
        "todos": { "type": "number" }
      }
    },
    "accounts": {
      "type": "array",
      "items": {
        "type": "object",
        "additionalProperties": true,
        "required": ["email", "label"],
        "properties": {
          "email": { "type": "string" },
          "label": { "type": "string" },
          "type": { "type": "string" },
          "calendarId": { "type": "string" }
        }
      }
    },
    "calendars": {
      "type": "array",
      "items": {
        "type": "object",
        "additionalProperties": true,
        "required": ["id", "name"],
        "properties": {
          "id": { "type": "string" },
          "name": { "type": "string" },
          "color": { "type": "string" }
        }
      }
    },
    "sections": {
      "type": "object",
      "additionalProperties": true,
      "properties": {
        "urgent": { "type": "array" },
        "tomorrowSchedule": { "type": "array" },
        "calendarProposals": { "type": "array" },
        "suggestedReplies": { "type": "array" },
        "todos": { "type": "array" },
        "business": { "type": "array" },
        "personal": { "type": "array" },
        "financial": { "type": "array" },
        "waiting": { "type": "array" },
        "newsletter": { "type": "array" },
        "spam": { "type": "array" }
      }
    },
    "brief": {
      "type": "object",
      "additionalProperties": true,
      "required": ["bottomLine", "items"],
      "properties": {
        "bottomLine": { "type": "string", "maxLength": 400 },
        "keyPoints": {
          "type": "array",
          "maxItems": 5,
          "items": { "type": "string" }
        },
        "items": {
          "type": "array",
          "maxItems": 6,
          "items": {
            "type": "object",
            "additionalProperties": true,
            "required": ["id", "title", "development", "status"],
            "properties": {
              "id": { "type": "string" },
              "title": { "type": "string", "maxLength": 120 },
              "account": { "type": "string" },
              "priority": { "type": "number" },
              "status": { "type": "string", "enum": ["action_required", "awaiting_reply", "monitoring", "new", "resolved"] },
              "background": { "type": "string" },
              "development": { "type": "string" },
              "assessment": { "type": "string" },
              "action": { "type": "string" },
              "due": { "type": "string" },
              "conversationKeys": { "type": "array", "items": { "type": "string" } },
              "viewThreadAccount": { "type": "string" },
              "viewThreadId": { "type": "string" },
              "calendarSuggestion": {
                "type": "object",
                "additionalProperties": true,
                "required": ["title"],
                "properties": {
                  "title": { "type": "string" },
                  "start": { "type": "string" },
                  "end": { "type": "string" },
                  "details": { "type": "string" },
                  "location": { "type": "string" }
                }
              },
              "memory": { "type": "string" }
            }
          }
        },
        "otherDevelopments": {
          "type": "array",
          "maxItems": 12,
          "items": {
            "type": "object",
            "additionalProperties": true,
            "required": ["text"],
            "properties": {
              "text": { "type": "string" },
              "account": { "type": "string" },
              "source": { "type": "string" },
              "viewThreadAccount": { "type": "string" },
              "viewThreadId": { "type": "string" }
            }
          }
        },
        "routineTraffic": {
          "type": "object",
          "additionalProperties": true,
          "properties": {
            "count": { "type": "number" },
            "note": { "type": "string" }
          }
        }
      }
    }
  }
}
